書籍タイトル,著者,ハイライト内容
ヒットの設計図　ポケモンGOからトランプ現象まで (早川書房),デレク トンプソン、高橋 由紀子,世界の人々は、均一につながっているわけではない。そこには何十億もの、グループや仲間やカルトがある。ワッツ、ウルフ、フォレストが、コンピュータモデル、マッチングアプリ、缶バッジの顧客などを通して理解したのはそのことだ。主流派ではないが、当人たちにとって特別の共通点で結びついている小さなネットワークを見つけ、そこに働きかけることによって、確実に成長することができる。グループの中ではごく普通の 特別なことがら について、メンバーたちはいくら語っても語り飽きない。人々は、自分自身を変わり者にしている何かを、同じ仲間と共有したいのである。
トークの教室　「面白いトーク」はどのように生まれるのか (河出新書),藤井青銅,キチンとした文章で書いてしまうと、喋る時どうしてもそれに寄っていき、原稿を読んでいるようなトークになってしまう。それが人間の心理です。 　聞きたいのは本人の気持ちが入ったトークであって、用意された原稿を読む朗読ではないのです。
人工知能は人間を超えるか (角川ＥＰＵＢ選書),松尾 豊,自らを維持し、複製できるような生命ができて初めて、自らを保存したいという欲求、自らの複製を増やしたいという欲求が出てくる。それが「征服したい」というような意思につながる。生命の話を抜きにして、人工知能が勝手に意思を持ち始めるかもと危惧するのは滑稽である。
検証 ナチスは「良いこと」もしたのか？ (岩波ブックレット),小野寺 拓也、田野 大輔,いる。ナチ体制がユダヤ人を識別し、追放したり移送したりする際に、ＩＢＭが開発したパンチカードによる個人情報管理システムを利用していた
「最強」ソリューション戦略 (日本経済新聞出版),高杉康成,ソリューション活動の第１段階は、情報ギャップづくり（事前調査）です。既述の通り、ソリューション提案の基本は情報ギャップから生まれます。売り手が買い手に対して、顧客の情報により詳しくなり、自社の製品・サービスを使った課題解決の方法を提示できるだけの豊富な情報を備え、買い手との間に情報ギャップを作るのです。
「組織と人数」の絶対法則―人間関係を支配する「ダンバー数」のすごい力,トレイシー・カミレッリ、サマンサ・ロッキー、ロビン・ダンバー、鍛原 多惠子,　リーダーの役目は組織のマイクロマネジメントではなく、発展しながら変化し、自己修正し、学習するコミュニティ構造を構築することにある。そうすることで、組織は精神科医ウィルフレッド・ビオンの言う「成熟した作業グループ ★ 5」になることができる。これを達成するためにリーダーが取るべきバランスのよい手法は、無知と熟知のあいだ、統制と内発のあいだ、介入と静観のあいだにある。リーダーシップの所在は、これらの緊張関係、そしてリーダーと自分自身、部下、変化する職場の状況との関係にあるのだ。
「価値」こそがすべて！―ハーバード・ビジネス・スクール教授の戦略講義,フェリックス・オーバーフォルツァー・ジー、原田 勉,バリューカーブの分析には、まず、きめ細かな顧客セグメンテーションを行うことをお勧めします。多くの異なる顧客グループに対して、別々のバリューカーブを作成します。もし、２つのグループがほぼ同じバリュードライバーを持っていることがデータからわかれば、その２つのグループを１つのセグメントとして扱うことができます。しかし、大まかなグループ分けから始めると、戦略に影響を与える可能性のある微妙な違いが隠れたままになります。
HIGH OUTPUT MANAGEMENT,アンドリュー・S・グローブ、小林　薫,つまり、マネジャーが長期にわたり部下グループの生産性向上のため実施するような任意プロジェクトから成り立っている。こういったプロジェクトの在庫がないと、マネジャーは自分の空き時間を部下の仕事への余計な干渉に使いがちになるのである。
日本人のための第一次世界大戦史 (角川ソフィア文庫),板谷 敏彦,経済的なメリットがない戦争は起こらない。 　英独建艦競争のピークである１９０７年、イギリスの造船業者はドイツから５００万ポンド相当の鉄鋼製品を輸入し、ドイツもイギリスから３００万ポンド相当の鉄鋼製品を輸入していました。イギリスのヴィッカース社が建造した我が国の戦艦「三笠」の防御鋼板はドイツのクルップ社製でした。両国の技術が混ざっていたのです。
運　ドン・キホーテ創業者「最強の遺言」 (文春新書),安田 隆夫,　私はこれまで、「戦略や戦術を語る前に、まずは戦闘モードを全開にせよ」と、口を酸っぱくして現場に、戦う姿勢の重要性を唱えてきた（いまだに唱え続けている）。
もっと早く、もっと楽しく、仕事の成果をあげる法 知恵がどんどん湧く「戦略的思考力」を身につけよ,古谷 昇,リーダーの特権として許された手段の選択肢が社内の誰よりも多いわけだから、ときにはこれをフルに行使してでも、経営者でなければできない発想で会社を経営していく。それをいまズルイ経営といったわけだが、実際こういうのは、ある意味でどうも経営者の義務でさえあるのではないか？
「価値」こそがすべて！―ハーバード・ビジネス・スクール教授の戦略講義,フェリックス・オーバーフォルツァー・ジー、原田 勉,悲しいことに、すべてにおいてより良くなろうとする試みは、凡庸さを保証するものなのです。希少なリソースを多くのバリュードライバーに分散させることで、組織は真のエクセレンスを達成することが不可能になるのです。
国家はなぜ衰退するのか　権力・繁栄・貧困の起源（上）,ダロン・アセモグル、ジェイムズ・A・ロビンソン、鬼澤 忍,したがって成長が進むのは、みずからの経済特権の喪失を心配する経済的敗者によって、またみずからの政治権力の毀損を恐れる政治的敗者によって、成長が阻止されない場合に限られるのである。
日本人のための第一次世界大戦史 (角川ソフィア文庫),板谷 敏彦,ところが１８９０年になって、バルカン半島においてロシアと、ドイツの盟友であるハプスブルクの対立が鮮明化するとヴィルヘルム二世はこれを理由に、ロシア側が希望したにもかかわらず条約の期限を更新しませんでした。
良い戦略、悪い戦略 (日本経済新聞出版),リチャード・Ｐ・ルメルト、村井章子,したがって経営者はエントロピーを念頭に置き、たとえ戦略や競争環境に変化がない場合でも、目標や組織や行動が本来の方向に向かっているか、注意を払わなければならない。
エンタメビジネス全史　「IP先進国ニッポン」の誕生と構造,中山 淳雄,日本の出版業界の特徴は「再販売価格維持制度（価格の固定）」と「委託制度（書店が買い取らずに出版社に返品できる仕組み）」、そして出版－取次－書店が生み出す流通構造の３点にある。本は定価販売で安売りされず、また書店が在庫リスクをもたないので売れない本も店頭に並べやすく、多種類の本をそろえることができる。
現代経済学の直観的方法,長沼伸一郎,一般に海軍力というものは、兵士の勇猛さよりも艦艇の建造費が重要になるのであり、経済力に依存する面が強い。そしてマンパワーの少ない英国としては、そうした技術力の優位によってしか大陸側の陸軍国に対抗できなかったため、その国防力の基盤としての経済力には、他の国よりも切実な関心を払わざるを得なかった
「価値」こそがすべて！―ハーバード・ビジネス・スクール教授の戦略講義,フェリックス・オーバーフォルツァー・ジー、原田 勉,　このように、ブランドは消費者に信頼感を与え、期待どおりの品質の製品を購入していることを保証することで、価値を生み出しているのです。このようなブランドプレミアムは、製品の品質にばらつきのある国で大きくなるのは当然です。たとえば、中国では、ジェネリック医薬品はほぼ国際価格で販売されています ★ 11。しかし、ブランド医薬品の価格は６倍にもなります。医薬品の安全性に関するスキャンダルとそれによる消費者の不安が、この驚くべきブランドプレミアムの一因となっているのです ★ 12。
ブランディングの誤解　P＆Gでの失敗でたどり着いた本質,西口 一希,　ブランドという言葉は、「牛の焼き印」が語源だといわれています。農家が他者の牛と自分の牛を識別するための印です。ここから転じて、ブランドとは顧客が商品を識別するための記号のようなものを意味します。
脳は世界をどう見ているのか　知能の謎を解く「1000の脳」理論,ジェフ ホーキンス、大田 直子,新皮質は古い脳がそうした化学物質をいつ放出すべきか決めるのを助けるかもしれないが、古い脳がなければ、私たちは恐怖や悲しみを感じないだろう。死への恐怖や喪失の悲しみは、機械が意識や知能をもつのに必要な材料ではない。私たちがわざわざ機械に恐怖や感情に相当するものを与えないかぎり、機械は電源を切られたり、分解されたり、スクラップにされたりしても、まったく気にしないだろう。
利他・ケア・傷の倫理学,近内悠太,僕らは、間違いがある から 言語ゲームが停止すると思っていますが、そうではなく、逆に、言語ゲームを止めてしまう振る舞い一般を僕らは「間違い」と呼んでいるのです。
戦略の要諦 (日本経済新聞出版),リチャード・Ｐ・ルメルト、村井章子,経験豊富なデザイナーがまったく新しい設計に取り組むときには、まず相反する重要な要素、矛盾する要素、両立し得ない要素がないかを探し、そこに注目する。問題の解決をむずかしくしている元凶はいったいどれなのか、と自問するわけだ。その元凶の本質を満足のゆくまで理解するのが先決で、解決方法を考え始めるのはそのあとだ＊
子どもは40000回質問する～あなたの人生を創る「好奇心」の驚くべき力～ (光文社未来ライブラリー),イアン・レズリー、須川 綾子,　私たちはミステリーよりもパズルの視点で物事を捉えようとする傾向がある。パズルは解決可能だとわかっているからだ。「オサマ・ビンラディンはどこにいるのか？」という問いはパズルだ。それが解決されたときは大きな歓喜が訪れた。「イスラム過激派によるテロと闘うにはどうすべきか？」という問いはミステリーであり、ビンラディンの居場所より重要性はずっと高いが、あまりにも複雑で扱いにくそうに見えるので、一般の人々のあいだやメディアにおける関心は相対的に低くなる。
生成AI時代の言語論 THINKING「O」,大澤真幸、今井むつみ、秋田喜美、松尾豊,　哲学者のカントに「超越論的仮象」という概念があります。仮象とは、つまり幻想のことです。普通の仮象は、理性を働かせれば排除することができる。しかし、理性によって除去できない仮象もある。それは、まさに理性が働くために前提にせざるをえない仮象です。そういうものを、カントは超越論的仮象と呼びました。「個人がそれぞれ自由意志をもっている」ということは、そのような仮象です。そのことを前提にしないと、私たちは、何が善く、何が悪いといった道徳的な判断もできなくなってしまう。誰の責任で、誰に罪があるのか、といったことも議論できなくなってしまいます。ですから、自由意志は幻想だとしても、理性的な判断をするために必要になる幻想なので、それは捨て去らないほうがいいのです。
エンジニアリング組織論への招待　～不確実性に向き合う思考と組織のリファクタリング,広木 大地,いるのであれば、それはメンターがその行動を見ることができます。しかし、「悩む」であれば、メンターは心の状態を観察することはできません。
北条氏の時代 (文春新書),本郷 和人,泰時はシステムやルールを作る能力に長けていました。評定衆の制定や、執権、連署制度の確立などの統治システムと、御成敗式目などのルールを次々と生み出していったのです。むき出しの暴力による支配はコストがかかりすぎ、結果、誰の利益にもならないという冷静な視線があったのでしょう。 　つまり泰時こそ、関東武士で初めて本格的に政治というものを行った人物といえるのです。
経営者こそ投資家である 企業価値創造のためのキャピタル・アロケーション (日本経済新聞出版),手島直樹,それは、「投資家志向」です。極論すれば、「オペレーション志向」は現場に任せれば良いのです。経営者には、「負け犬」化しかねない事業や「非ベストオーナー」事業を投資家のようにタイミングよく切り離す判断が求められるのです。つまり、「足し算」だけでなく、時には「引き算」も必要なのです。実際、事業売却に際して多額の買収プレミアムを得ることができれば、「引き算」が「足し算」以上の結果をもたらすことになるのです。
三行で撃つ 〈善く、生きる〉ための文章塾,近藤 康太郎,短文がずっと続く文章は単調で、むしろスピード感を削ぐ。短文と長文を出し入れする。効果的にリズムチェンジする。ここぞというときに変拍子を入れてみる。
検証 ナチスは「良いこと」もしたのか？ (岩波ブックレット),小野寺 拓也、田野 大輔,一九三二年一一月の国会選挙でナチ党が二〇〇万票余りを失って党勢を後退させ、反対に躍進を続ける共産党の脅威が高まったことも、この選択を後押しした。保守勢力の間では、ヒトラーを首相に据えて閣僚の多くを保守派で固めれば、過激な煽動家を政権内で飼いならして、その大衆的基盤を政権運営に利用できるのではないかという観測も広がった。
機嫌のいいチームをつくる,吉井理人,筑波大学出身の高校野球の監督がこう言っていた。 「コーチングは凧揚げみたいなもの。揚げるときは糸を思い切り引っ張ってあげなければならないが、揚がってからは、風向きによって変な方向に行かないように、微調整するだけでいい。そういうイメージでコーチングするといい」 これは良い例えだ。
財閥のマネジメント史　誕生からバブル崩壊、令和まで (日本経済新聞出版),武藤泰明,財閥はなぜ非関連分野に多角化するのかというと、 ●そもそも事業に直結するような経営資源（技術、顧客など） をあまり持たない ●国内で高収益をあげていれば、資金は潤沢にある という状況のはずなので、潤沢な資金を使って、必ずしも得意ではない非関連事業に進出し、うまくいけば競争相手が少なくて高収益が実現できることになります。そして、新たに参入するビジネスは、先進国ではすでに実施されているものなので、参入リスクがそれほど大きくありません。 　また日本の場合は、明治政府が外資に規制をかけていたので、少なくとも国内では、ほとんど先進国企業との競争がありませんでした。多角化しやすい経営環境だったと言うことができるでしょう。
"Zero to One: Notes on Startups, or How to Build the Future (English Edition)",Peter Thiel、Blake Masters,but rather that it will be a time when the world looks different from today.
勝利の流れをつかむ思考法　F1の世界でいかに崖っぷちから頂点を極めたか,山本 雅史,重要なのは、思うようにやらせてその人がいかに楽しく問題に挑めるか、ということだ。だからこそ、そこでは悪い部分で評価する〝減点主義〟ではなく、プラスの部分を一緒に増やしていく〝加点主義〟が求められる。自分で目標を決めさせ、最後まで責任をもってやり遂げるのを見守ることこそ、上司の役割なのだ。
交易する人間（ホモ・コムニカンス）　贈与と交換の人間学 (講談社学術文庫),今村仁司,生まれる。「我」としての個人は他人とのつきあいのなかで形成される。個人は社会生活の結果である。
とにかく仕組み化――人の上に立ち続けるための思考法,安藤 広大,会社は、目的や目標に向けて進んでいく存在です。 企業理念にどんどん近づいていく。 そうやって全体が前に進んでいくことで発生するのが、「進行感」です。 組織で働く人はみな、この進行感を感じてほしいと思っています。 組織全体が前へ前へと動いていく感覚です。 それにより、 組織の一員であることに「誇り」を持つことができます。 それが、「この会社にいること」の利益なのです。 目先のボーナスや社員旅行などでは味わえません。 進行感があることにより、社員は「辞める理由」がなくなります。
成人発達理論による能力の成長 ダイナミックスキル理論の実践的活用法,加藤洋平,このメタファーが示す重要なことは、私たちの能力は階段状のステップとは異なり、成長のプロセスにあらかじめ決められた順番や形というのは存在しない、ということです。 要するに、私たちの能力は、置かれている環境や取り組むタスクと相互作用することによって、様々な能力が徐々に網の目を強固に張り巡らせていく形で成長していくのです。
世界は贈与でできている　資本主義の「すきま」を埋める倫理学 (NewsPicksパブリッシング),近内悠太,宛先を持つという僥倖。宛先を持つことのできた偶然性。 　 贈与の受取人は、その存在自体が贈与の差出人に生命力を与える。
PLG　プロダクト・レッド・グロース「セールスがプロダクトを売る時代」から「プロダクトでプロダクトを売る時代」へ,ウェス・ブッシュ、UB Ventures、八木映子,理想的な利用ガイドメールは、特定のオンボーディング・タスクの完了または未完了をトリガーに配信される。
世界はシステムで動く ― いま起きていることの本質をつかむ考え方,ドネラ・Ｈ・メドウズ、枝廣淳子、小田理一郎,システムは通常、そのシステムでありつづけ、その要素をすべて取り替えたとしても、つながりと目的が同じである限り、変わるとしてもゆっくりとしか変わりません。
運動しても痩せないのはなぜか：代謝の最新科学が示す「それでも運動すべき理由」,ハーマン・ポンツァー、小巻 靖子,カロリーを燃やす以上に食べると、体重が増える。カロリーをとる以上に燃やすと、体重が減る。炭水化物、脂肪、タンパク質をどんな割合で組み合わせても、エネルギー消費量や体重にはこれといった影響が及ばず、適正体重を達成したときのメリットに違いが生じるわけでもない。
言語の本質　ことばはどう生まれ、進化したか (中公新書),今井むつみ、秋田喜美,音と意味が自然につながっていて、それを赤ちゃんでも感じられることが、「単語に意味がある」という「名づけの洞察」を引き起こす きっかけ になるのではないか。だから大人は赤ちゃんにオノマトペを多用するのだろう。（
恐れのない組織――「心理的安全性」が学習・イノベーション・成長をもたらす,エイミー・C・エドモンドソン、村瀬俊朗、野津智子,心理的安全性とは、大まかに言えば「みんなが気兼ねなく意見を述べることができ、自分らしくいられる文化」のことだ。より具体的に言うなら、職場に心理的安全性があれば皆、恥ずかしい思いをするんじゃないか、仕返しされるんじゃないかといった不安なしに、懸念や間違いを話すことが
「組織と人数」の絶対法則―人間関係を支配する「ダンバー数」のすごい力,トレイシー・カミレッリ、サマンサ・ロッキー、ロビン・ダンバー、鍛原 多惠子,・私たちにはホモフィリーと呼ばれる傾向がある。自分に似た人に自然に引き寄せられるのだ。だが、ホモフィリーは諸刃の剣でもある。職場における友情は安心感と心地よい仕事上の関係を与えるかもしれないが、イノベーションと最良の意思決定には多様な視点が必要とされる。優秀なリーダーであるためには、職場の友情を促進する一方で、ときにはサイロから出るようにも強いなければならないことを認識すべきである。
大坂堂島米市場　江戸幕府ｖｓ市場経済 (講談社現代新書),高槻泰郎,諸大名が領民に粛々と米を作らせて大坂に運ぶという、いわばシンプルな経済構造は、鎖国体制の確立、大坂市場の物理的基盤の整備、幣制の統一、全国規模での農地開発などの要因が複合的に作用して、一七世紀中後期を通じて確立されたものであった。「天下の台所」大坂は、決して商人だけの力で作り出されたものではなかったのだ。
経営者こそ投資家である 企業価値創造のためのキャピタル・アロケーション (日本経済新聞出版),手島直樹,Ｍ＆Ａの発表直後から１年間にわたり一貫して株価パフォーマンスがプラスの案件は買収プレミアムの平均値が 25・８％、一方で一貫してマイナスの案件では 40・５％と高水準となっています（全案件の平均値は 35・７％）。つまり、買収プレミアムと株価リターンは反比例しているのです。
経営者こそ投資家である 企業価値創造のためのキャピタル・アロケーション (日本経済新聞出版),手島直樹,・持続的なキャッシュフロー創出力こそ最強の資金調達源であり、外部調達を必要とせず、投資と株主還元の「二刀流」を実行したり、ターゲットとする資本構成を容易に実現したりすることを可能にする。
なぜ、TikTokは世界一になれたのか？,マシュー・ブレナン、露久保由美子,　チームは同時に、他のショート動画やソーシャルメディアのプラットフォームにアカウントを作り、「抖音」の透かし（ウォーターマーク） 入りの動画を投稿した。動画に興味を持った人は透かしを見て、アプリストアでその名前を検索してくれるので、これはちょっとした広告のようなものだった。その後、動画クリエイターのユニークなユーザーＩＤが、点滅するロゴの横の透かしに追加された。この小さな、けれど極めて重要な変更によって、人々が他のプラットフォームで自分の動画を共有する動きに拍車がかかった。それが自分のアカウントでファンを増やすことにつながるからだ。
