書籍タイトル,著者,ハイライト内容
歴史と戦争 (幻冬舎新書),半藤一利,　この時、頭山満以下の人たちが読んだ檄文がこれまたものすごい。 「十万の英霊と二十億の国費とを犠牲にしたる戦勝の結果は、 千載 ぬぐうべからざる屈辱と、列強四囲の嘲笑のみである。だれの責任か」 　──「十万の英霊と二十億の国費」、このスローガンが、大正から昭和にかけて、つまり満洲という広野をめぐっての列強との 鬩 ぎ合いのときに、「満洲を手放すのは十万の英霊と二十億の 国帑、これを無駄にするのか」というように使われて、昭和の陸軍軍人の頭の中にたたき込まれていくわけなんです。満洲問題の根っこは、日露戦争後のこの時にできたんです。
自由になるための技術　リベラルアーツ,山口周,より低次の理論理性的な損得計算の結果とそれを価値判断するより高次の実践理性の階層の違いを、常にリーダーには意識していただきたいのです。
ＵＳＪを劇的に変えた、たった１つの考え方　成功を引き寄せるマーケティング入門 (角川書店単行本),森岡 毅,戦況分析とは、「市場構造」をよく理解して、それを味方につけるためにやる のです。ビジネスに限らず、人間の営みは全て「構造的な仕組み」に収束していきます。多くの人間がいて社会を形成し、絶えず無数のミクロの利害が衝突して力学が蓄積され、全体としての構造が定まっていきます。「構造」とは、わかりやすく言えば、「全体としての人々のやり方」です。
未来を実装する――テクノロジーで社会を変革する４つの原則,馬田隆明,悪と不正を最小限に抑え、間違ったときに正せるような制度を維持していくためには、専制国家よりも民主主義を維持していくべき
組織――「組織という有機体」のデザイン 28のボキャブラリー,横山 禎徳,企業に限らず、組織というものは、外部環境が変化すればこれに適応しようとするし、内部的にも時間とともに人材やスキルの分布が変わっていくというように、常に変化していく。つまり、現実の組織は、組織図で描き切れるようなスタティックなものではなく、生命体、有機体と同じようなダイナミック（動的） な性格を持っている。すなわち、オーガニゼーションなのである。
三行で撃つ 〈善く、生きる〉ための文章塾,近藤 康太郎,世の中のすべての事象、おもしろい現象に、感性を研ぎ澄ませていなければならない。 貪欲 でなければならない。 自分がいまだその魅力をとらえていない、言語化できていない物事は、世界のあちこちにある。そこに、鼻を突っ込む。おもしろいこと、おもしろい人に対しては、きわめて「greedy」でなければならない。 　 そうした「感性」は、鍛えることができる というのがポイントだ。なにかを好きになるのも、じつは、練習なのだ。
不格好経営 (日本経済新聞出版),南場智子,を
ゾーンマネジメント,ジェフリー・ムーア、栗原　潔,株価を劇的に変化させるのは、ある程度以上の規模の新規成長カテゴリーへの参入だ。そのようなカテゴリーへの参入規模が、企業の総収益の十パーセントを超え、将来的に十五パーセントから二十パーセントを超えることが期待されれば、投資家はこの新たな収益源からの潜在的リターンを新鮮な目で評価するようになる。
アフターデジタル２ ＵＸと自由,藤井 保文,平安グッドドクターでは、日常的に高頻度な接点を取りながら、商品ニーズや信頼獲得のフラグが立ったら、来店を促したり、電話をかけて話を聞いたり、営業担当者が訪問したりしています。これを支える技術革新として、データを保持する際、購入や成約などのコンバージョンをゴールとしたファネル型のデータではなく、ユーザーとの関係構築や状況の可視化を目的とした、IDベースのシーケンスデータとして保管される必要があります。
利他・ケア・傷の倫理学,近内悠太,大切にしているものは、モノとしては存在していない。それは、関係性だからです。 　それは、あなたと私のあいだに、言葉を通して、物語としてその輪郭が立ち現れる。
美しき免疫の力　動的システムを解き明かす,ダニエル・M.デイヴィス、久保　尚子,生存に不可欠、かつ、複雑な過程に関与する細菌性タンパク質分子に狙いを定めているからこそ、ペニシリンは今も多くの細菌に対して有効なのだ。
財閥のマネジメント史　誕生からバブル崩壊、令和まで (日本経済新聞出版),武藤泰明,ただ、総合商社がいろいろな商品を取り扱うことの合理性は、本社、本家が非関連多角化をしていたところにありました。たとえば、石炭を販売して、炭鉱のために掘削機械を輸入する。あるいは、繊維製品とあわせて米などの食料を軍に納品する、そんなイメージです。 　つまり、開国→一気に産業化→非関連多角化→総合商社、という流れを見ることができるのです。
体験格差 (講談社現代新書),今井悠介,例えば、ドイツでは日本のＮＰＯに似たフェアアイン（Verein） と呼ばれる主に非営利の組織が 60 万以上も存在し、子どもたちの「体験」のあり方にも深く関わっている。 　フェアアインとは、同じ趣味や目的を持つ市民たち自身が団体をつくり、その活動を行政も助成金や税制といった資金面などからバックアップするような仕組みだ。
良い戦略、悪い戦略 (日本経済新聞出版),リチャード・Ｐ・ルメルト、村井章子,良い戦略に必要なのは、さまざまな要求にノーと言えるリーダーである。戦略を立てるときには、「何をするか」と同じぐらい「何をしないか」が重要なのである。
アフターデジタル２ ＵＸと自由,藤井 保文,このように衆安保険のモデルは、 サービサーが勃興し乱立する時代を捉え、そのサービサーが保険を作りたい、付加価値を増やしたいと考えた際に高速でそのサービスにおける保険商品を作る、新時代型の保険OEM と言うことができます。
RANGE（レンジ）　知識の「幅」が最強の武器になる,デイビッド・エプスタイン、東方 雅美、中室 牧子,いつならグリットがあるか」を尋ねるべきなのだ。「その人に合う状況に置けば、熱心に仕事をする可能性が高く、それはまるで外からグリットを得たように見えるだろう」とオーガスは言う。
ガザとは何か～パレスチナを知るための緊急講義,岡真理,十九世紀末のヨーロッパで、フランスのドレフュス事件を契機に、ヨーロッパ・キリスト教社会の歴史的宿痾とも言うべきユダヤ人差別・反ユダヤ主義からユダヤ人が解放されるには、ユダヤ人がマジョリティを占めるユダヤ国家を創るしかないという考えが生まれ、パレスチナにユダヤ国家を建設するという政治的プロジェクト「シオニズム」が登場します。
日本人のための第一次世界大戦史 (角川ソフィア文庫),板谷 敏彦,しかし、いざ第一次世界大戦が勃発すると、イタリアが「リソルジメント」のために戦うべき相手は、依然として「未回収のイタリア」が多く残るハプスブルクだったのです。
三行で撃つ 〈善く、生きる〉ための文章塾,近藤 康太郎,自分なんていうものは、他者の思考の集積なのだ。他者に耕された土地なのだ。 であるならば、広く、深く、耕されてしまえばいい。カルチャーとは、カルティベート（cultivate）されるとは、耕されるという意味だ。百姓でもあるわたしは、知っている。深く、何度も耕す田の実りは、豊かだ。
Build: An Unorthodox Guide to Making Things Worth Making (English Edition),Tony Fadell,"As a manager, you should be focused on making sure the team is producing the best possible product. The outcome is your business. How the team reaches that outcome is the team’s business. When you get deep into the team’s process of doing work rather than the actual work that results from it, that’s when you dive headfirst into micromanagement. (Of course sometimes it turns out that the process is flawed and leads to bad outcomes. In that case, the manager should feel free to dive in and revise the process. That’s the manager’s job, too.)"
岩田さん: 岩田聡はこんなことを話していた。 (ほぼ日ブックス),ほぼ日刊イトイ新聞,Wiiの片手でつかえるコントローラーにしても、振り返るとこうなると決まってたように思うんですけど、「誰かひとりのグレートなアイディアでこうなった」というものではなく、たくさんの人のバラバラの思いが不思議に融合してこうなったという、想像の及ばない経緯があって、最終的にこのかたちになった感じがしますね。
なぜ世界はそう見えるのか,デニス・プロフィット、ドレイク・ベアー、小浜杳,対極の政治思想を持つ人々は、同じ社会的事象が起きている同一の物理的世界に暮らしているように見えて、じつはそれぞれ天と地ほどにかけ離れた主観的経験をくぐっているのである。
サイロ・エフェクト　高度専門化社会の罠 (文春文庫),ジリアン・テット、土方 奈美,の試みも同じだ。ただどちらの事例もある重要な前提条件を示唆している。データの分類方法が自動的に変わることも、サイロがおのずから崩壊することもない。誰かがコンピュータのプログラムを変える必要がある。
世界は贈与でできている　資本主義の「すきま」を埋める倫理学 (NewsPicksパブリッシング),近内悠太,歴史を学ぶというのは、そこに何ら必然性がなかったことを悟るプロセスでもあります。 　この世界の 壊れやすさ。 　この文明の 偶然性。 　これに気づくために僕らは歴史を学ぶのです。
運動しても痩せないのはなぜか：代謝の最新科学が示す「それでも運動すべき理由」,ハーマン・ポンツァー、小巻 靖子,ホミニンの先祖が狩猟採集生活に移行すると、信じがたいほどの身体活動が必要になり、体がそれに対応した。適応は体のあらゆる部分で見られた。筋肉、心臓、脳、消化管──すべてが変化した。第４章で述べたように、これに伴って細胞の仕事のペースに変化が生じ、代謝率が増加して、狩猟採集戦略に必要なエネルギーの供給が可能になった。このはるか昔の適応が、今日の私たちに影響を及ぼしている。私たちの体は活発に動かすようにできているのだ。現代の工業化社会では食物を毎日自分で手に入れる必要がないため、体を適切に機能させるには運動をしなければならない。これが狩猟採集時代の遺産である。
言語の本質　ことばはどう生まれ、進化したか (中公新書),今井むつみ、秋田喜美,このように、日本語オノマトペの歴史においては、複数の副詞形と動詞形が栄枯盛衰を繰り返してきた。副詞として生き生きとした描写力を持っていたオノマトペが、動詞となり一般語のように目立たなくなる。一方で新しいオノマトペ副詞が生まれてくる。そうした変化を繰り返し、語彙全体としてはアイコン性と恣意性の間の絶妙な均衡が保たれる。言語の進化はそれを繰り返す歴史と言えるだろう。
THE NEXT BIG THING スティーブ・ジョブズと日本の環太平洋創作戦記,榎本幹朗,ＣＥＲＮ研究所では、ふたりと同い年のティム・バーナーズ゠リーがその黒いキューブを使ってＷＷＷ（ワールドワイドウェブ） を生み出していた。リーは、わずか二ヶ月で世界初のウェブ・ブラウザとウェブ・サーバーのプログラムを書きあげた。すべてネクストのオブジェクト指向の開発環境のおかげだという。 　「もしネクスト・キューブがなかったら、ＷＷＷの開発にあと数年はかかったろう」 　そう謝辞を述べている ★ 028。たしかにネクスト・キューブは失敗作だった。だがたとえ失敗作であっても、優秀な魂たちのすべてを結晶した作品は、世界の何かを突き動かすのかもしれない。ネクスト・キューブのおかげで、インターネットの時代は数年はやく到来した。
最高を超える,フランク・スルートマン、福永 詩乃,ミッションは「切迫感」を持って扱わなければならない。営業の世界では「時間はあらゆる商談を殺す」と言われる。時間は味方ではない。新規参入者などのリスクをもたらす存在だ。
「何回説明しても伝わらない」はなぜ起こるのか？　認知科学が教えるコミュニケーションの本質と解決策,今井むつみ,「人は、何をどう聞き逃し、都合よく解釈し、誤解し、忘れるのか」を知ること。 そして、そうした特徴を持つ人間同士が、 それでも伝え合えるように考えること が、「いいコミュニケーション」の実現には不可欠です。
現代経済学の直観的方法,長沼伸一郎,彼らがこの目的のために採用したのが「 喜捨」という手段だった。要するに金持ちが貧しい者に施しをすることを、信徒の基本的義務に据えたわけである。
脳の大統一理論　自由エネルギー原理とはなにか (岩波科学ライブラリー),乾 敏郎、阪口 豊,自由エネルギー原理では、 α 運動ニューロンに送られる信号は運動実行後にゴール状態で得られるはずの自己受容感覚（筋感覚） の予測信号と考える。そして、 α 運動ニューロンは、この予測信号と筋紡錘から送られてくる感覚信号を比較して予測誤差信号を生み出し、それを筋に送ることで予測誤差が小さくなるように筋を収縮させる。
トークの教室　「面白いトーク」はどのように生まれるのか (河出新書),藤井青銅,トークの展開上、先に説明をしておかないと伝わらない点は意識して描写し、他はそんなに意識せず普通に話せばいいのでしょう。
いまだ成らず 羽生善治の譜 (文春e-book),鈴木 忠平,「将棋において経験は生きない」 　最善手という〝正解〟が存在し、人工知能がそれを瞬時に導き出す以上、ＡＩ登場以前の葛藤の歴史は力になり得ないというわけだ。だが、佐藤はそうは考えなかった。なぜなら将棋を指す棋士は生身の人間であり、人は自らの脳で考え、経験したことを生かして前に進んでいくしかないからだ。
ゾーンマネジメント,ジェフリー・ムーア、栗原　潔,パフォーマンス・ゾーンでも見てきたように、市場で長期に安定した地位にいると、プロダクティビティ・ゾーンにおいても水準以下の業務による慣性力が溜まっていく。好ましくない状態だが、修正が不可欠という状態でもない。しかし、市場カテゴリー自体が破壊的変化を受けているときには、これらの問題は直接かつ迅速に解決すべきリスクを生じさせる。
リアライン―ディスラプションを超える戦略と組織の再構築,ジョナサン トレバー、安藤 貴子、ＮＴＴデータ経営研究所Ｒｅ：Ａｌｉｇｎ研究チーム、池上 重輔,本書では、組織ケイパビリティを企業の事業戦略の実行を支えるコンピテンシー、能力、活力を保有していることと定義する。
スタートアップの知財戦略,山本飛翔,「オープンクローズ戦略」 とは、 プロダクトやサービスについて、 コア領域を特定 した上で、 市場拡大のためのオープンな領域と、 自社の利益を確保するためのクロー ズな領域を構築する戦略をいう。 次
経営者こそ投資家である 企業価値創造のためのキャピタル・アロケーション (日本経済新聞出版),手島直樹,は選択と分散？ 　では、経営者のスタンスはどうでしょうか。オムロンの山田義仁社長は次のように述べています。 「『選択と分散』がすごく大事なキーワードになると思います。今までは『選択と集中』でした。もちろん、どの国、どの業界という選択はしなければいけませんが、集中は危ういと感じています 注 34」
エンタメビジネス全史　「IP先進国ニッポン」の誕生と構造,中山 淳雄,ゲームチェンジャーとなったのは『新世紀エヴァンゲリオン』（１９９５年）である。テレビ東京、日本アドシステムズやキングレコードなども絡めて製作された同作は、「製作委員会方式による成功作」となった（現在の委員会の仕組みとは違ったが）。これによって毎週放送の 12 話３カ月モノのアニメ制作費１・５億～２億円（１話１０００万～１５００万円）を３～ 10 社程度から集め、「皆で所有して、皆で広げる」という方式によるアニメ制作が一般化する。現在は年３００本近いアニメ作品が作られているが、そのほぼすべてが委員会方式である。
千年投資の公理 ──売られ過ぎの優良企業を買う,パット・ドーシー,堀がもたらす企業の弾力性は、素晴らしい企業を妥当な価格で買いたい投資家にとって心理的に大きな後ろ盾となる。何かがうまくいかないかぎり、質の高い企業がお買い得になることはめったにないからだ。しかし、株価が安くなる前、つまり新聞の見出しが「成長」から「苦難」に変わる前に堀を分析しておけば、そのトラブルが一時的なものなのか、それとも末期的なものなのかを判断するための洞察を数多く得ておくことができる。
スマートシティとキノコとブッダ　人間中心「ではない」デザインの思考法,中西 泰人、本江 正茂、石川 初,スマートシティを捉えるために、『社会は情報化の夢を見る』などの著作で知られる佐藤俊樹氏の言う「ハイパー」と「ポスト」が参考になると思います。日本はこれまで、ついに情報化社会が来ると 70 年代ぐらいから繰り返しずっと言ってきましたが、時代ごとに読み解いていくと大きく分けて２つの捉え方があるといいます。１つは同じ価値観の延長線上にある高性能社会を指す「ハイパー」、もう１つはどこかで閾値を超えてシンギュラリティなどが起きてまったく異なる社会像が立ち現れると考える「ポスト」です。
戦略としての企業価値,佐藤 克宏,従来から言われてきた「キャッシュフロー経営」は、会計基準や会計処理方法による曇りを拭い去り、企業業績の真実をキャッシュフローによって理解しようとするものであった。そのため、財務諸表の一つとして、1999年度から「キャッシュフロー計算書」が追加された。
世界は贈与でできている　資本主義の「すきま」を埋める倫理学 (NewsPicksパブリッシング),近内悠太,ギブ＆テイク、ウィン‐ウィン。残念ながら、その中から「仕事のやりがい」「生きる意味」「生まれてきた意味」は出てきません。 　これらは、贈与の宛先から逆向きに返ってくるものだからです。
人類とイノベーション：世界は「自由」と「失敗」で進化する (NewsPicksパブリッシング),マット・リドレー、大田直子,加熱調理は食べ物をあらかじめ消化する。デンプンをゼラチン化し、可消化エネルギーをほぼ２倍にする。タンパク質を変性させ、卵やステーキを食べることによって得られるエネルギーを約４割増しにする。外部に追加の胃をもつようなものだ。したがって、なぜ私たちの歯は小さく、胃も小さく、消化管はほかの霊長類に比べて体重あたりで半分ちょっとしかないのか、その理由は加熱調理で説明がつく。この小さな消化管を働かせるコストは少ない──ほかの霊長類とくらべて、人間が消化管を生かしておくのに燃やすエネルギーは１割少ない。そう考えると、料理用の火は私たちにエネルギーを供給するだけでなく、エネルギーを節約させてもいる。
幣原喜重郎　国際協調の外政家から占領期の首相へ (中公新書),熊本史雄,ワシントン会議期間中に、加藤友三郎が「君はお人好しで、 自惚れているからいかん」（『同前』） と半ば諭したように、幣原の公明正大な言動の根底には、どこか性善説的な人間観が敷かれてい
運動しても痩せないのはなぜか：代謝の最新科学が示す「それでも運動すべき理由」,ハーマン・ポンツァー、小巻 靖子,私たちの代謝エンジンは、身体活動が活発化してコストが増加すると、なんとかやりくりしてそのための余地をつくりだし、最終的には１日のカロリー消費量が一定の狭い範囲内におさまるようにしている。その結果、体をよく動かす人──現代の狩猟採集民や過去の狩猟採集民、工業社会で定期的に運動をする人々──も、体をほとんど動かさない人と同じ量のエネルギーを燃焼することになった。
利他・ケア・傷の倫理学,近内悠太,つまり、サピエンスとは、他の動物であれば適応進化によって獲得するしかなかった形質を外部化することによって、 環境自体を変更してしまう種 なのです。先ほど、サピエンスが進化におけるバグだと言ったのは、この性質ゆえです。サピエンスは身体ではなく、環境（＝都市における制度・システム・テクノロジー） の側を変えてしまうという、進化のプロセスを裏切る種なのです。
体験格差 (講談社現代新書),今井悠介,重要なことは、これまでのクーポンの利用実績を振り返ると、９割以上がいわゆる狭い意味での「学習」を目的として利用されているということだ。つまり、学習塾、個別指導塾、家庭教師などでの利用がメインで、受験対策のニーズがやはり大きい。第一部でも紹介した通り、特に中学３年の時期には家庭が支出する学校外での平均的な学習費が大きくなるため、その負担への補塡という意味合いで利用されてきた。逆に言えば、「体験」を目的として利用されたケースは全体の１割に満たない。
グループ経営入門【第4版】: グローバルな成長のための本社の仕事,松田　千恵子,通常の企業価値計算においては、おおよそ５年程度のフリーキャッシュフローは各年きちんと予測し、それ以降は予測した最終年度の状態が永続すると仮定して数学的に処理します。
センスメイキング――本当に重要なものを見極める力,クリスチャン・マスビアウ、斎藤 栄一郎,蓄積された知識が多ければ多いほど、言い換えれば頭脳の備えが多ければ多いほど、直観的なすばやいひらめきが得意になると説明している。 　このような思考をカーネマンは「システム１」の思考モードと呼んでいる。ウィリアム・ジェームズが指摘したように、天才は「連続的に注意が向けられる対象物の性質ではなく、注意自体の性質が凡人とは違う」のだ。
