書籍タイトル,著者,ハイライト内容
ゾーンマネジメント,ジェフリー・ムーア、栗原　潔,具体的には、破壊的イノベーションの取り組みと持続的イノベーションの取り組みを分離し、前者を新規ビジネスとその運営モデルにフォーカスさせ、後者を既存ビジネスの拡張と改良にフォーカスさせなければならない。同時に、「収益パフォーマンス」を求める企業活動と「支援型投資」となる企業活動とを分離し、前者を現在の業績に、後者を将来への種蒔き効果にフォーカスさせなければならない。
新・ラグジュアリー　文化が生み出す経済 10の講義,安西洋之、中野香織,これはシャネルの次の言葉がインスピレーションになっています。 「ラグジュアリーの反対語は貧困、と思い込んでいる人がいるけど、それは違う。ラグジュアリーの反対語は、下品、なの」 　この場合の「下品」とは、本来のものではないものになろうとすること。不作法なこと。美意識が欠けていること。合理性を追求するあまりギスギスした状態になっていること。
北条氏の時代 (文春新書),本郷 和人,仮に「北条が将軍となります」と宣言すれば、朝廷はそれを認めたでしょう。しかし、これまで従ってきた御家人たちがどこまで納得し、従うのかは未知数です。東国武士が自分たちで担いだ、自分たちの代表であるという頼朝以来のリーダー像を、武士たちにとってより身近なポジションで実現したのが、北条義時であり、泰時、時頼でした。だから北条氏は将軍に「ならなかった」のです。
世界標準の経営理論,入山 章栄,この同質化プロセスを、アイソモーフィズム（isomorphism）と呼ぶ。ポール・ディマジオとウォルター・パウエルが1983年に『アメリカン・ソシオロジカル・レビュー』（ASR）に発表した論文で提唱した、制度理論の根幹メカニズムで
コンセプトのつくりかた,玉樹 真一郎,個々のビジョンがどれだけいい加減なものであったとしても、それらの ビジョンが集まれば集まるほど、そこからコンセプトを生み出しやすくなる
二兎を追う経営　トレードオフからの脱却 (日本経済新聞出版),淺羽茂,このように、トレードオフ関係にある価値に直面した場合、その関係を固定的なものと見るのではなく、３つめの価値を探すことが、二兎戦略につながるかもしれない。視点を変えることによって３つめの価値が見つかれば、３つめの価値をあきらめることによって、あるいは価値のグルーピングを変えることによって、トレードオフ関係にあると思われていた２つの価値がトレードオン関係に変わるかもしれない。そうすれば、二兎戦略を実現できるのである。
「組織と人数」の絶対法則―人間関係を支配する「ダンバー数」のすごい力,トレイシー・カミレッリ、サマンサ・ロッキー、ロビン・ダンバー、鍛原 多惠子,私たちが種として定住しはじめたのは、ほんの 1 万年前という最終氷期末期だった。そして、これらの定住地のいずれかに 1 万人以上が暮らしはじめたのはやっと約 4000 年前のことだ。 4000 年と言えば、ヒトの系統が大型類人猿から分岐してからの進化史のわずか 0・05％ にすぎない。
確率思考の戦略論　どうすれば売上は増えるのか,森岡 毅、今西 聖貴,戦略家の仕事は「構造」を診て「焦点」を定めることなのです。
ビジネスエリートになるための 教養としての投資,奥野 一成,将来的に利益を増やし続けることができるのかが重要なのであって、それができない企業はどんなにＰＥＲが低かろうが、長期投資には向かないのです。つまりＰＥＲはＰＥＲだけを見ていても割高なのか、割安なのか判断することはできませんし、国債の金利水準やその方向性との比較も重要なのです。
エンジニアリング組織論への招待　～不確実性に向き合う思考と組織のリファクタリング,広木 大地,視座が拡大縮小なら、視点はどの角度にライトを照らすのか、そして、そのライトの照らす広さが視野です。
運動しても痩せないのはなぜか：代謝の最新科学が示す「それでも運動すべき理由」,ハーマン・ポンツァー、小巻 靖子,だから、肥満の原因を代謝の低さに求めると、体重変化の原因と結果がまったく逆になってしまう。代謝はエネルギーバランスを 決定 しているのではなく、エネルギーバランスに 反応 しているのだ。
日露戦争、資金調達の戦い―高橋是清と欧米バンカーたち―（新潮選書）,板谷 敏彦,伊藤は今度の募集が最終であり、それで戦争を終わらせなければ、例え戦争に勝利しても財政的に破綻の可能性がある事を認識していたことになる。また外貨獲得の為の外人観光客の誘致などは現代と同じ政策で、一〇〇年も前から同じ事を考えていたとは興味深いものがあるだろう。
サイロ・エフェクト　高度専門化社会の罠 (文春文庫),ジリアン・テット、土方 奈美,人類が誕生してこのかた、分類というプロセスはわれわれとともにあった。人間と動物の大きな違いともいえる。それには当然の理由もある。われわれは日々複雑な環境に身を置いており、世界を扱いやすい 塊 に分類することである程度の秩序をつくらなければ、複雑性をきちんととらえ、対処することはできない。
企業変革のジレンマ　「構造的無能化」はなぜ起きるのか (日本経済新聞出版),宇田川元一,対話とは本来、わかったつもりになることで見えなくなっている事象に対し、自分はわかっていない（not-knowing）という前提に立って、その人に何が起きているかを知ろうとすることである ７。
グループ経営入門【第4版】: グローバルな成長のための本社の仕事,松田　千恵子,今後の将来予測の作り方は、事業部門が策定する、現場に根ざしたボトムアップ的な予測と、本社部門が投資家として策定する、非連続な変化への対応も含めて全体最適を考えたトップダウン的な予測とを、双方向的にすり合わせていくといったものになるでしょう。事業部門からいえば、グループ内投資家である本社部門に対して ＩＲを行っている ようなものです。一方、グループ内投資家である本社はそのＩＲを受けて、自ら持っている仮説からの乖離度を検証し、全社的な視点から課題や質問、期待値といったものを投げかけて、ひとつにまとめていくということになります。
価格支配力とマーケティング,菅野 誠二、千葉 尚志、松岡 泰之、村田真之助、川﨑稔,ここで小林製薬のマーケティングの中核となるｎ＝１開発を解説する。 　マーケティング部内の商品開発担当は、商品の「生みの親」としてコンセプトからネーミング、さらにパッケージに至るまでのすべてを管掌する。対して、ブランドマネージャーは「育ての親」と呼ばれ、営業や広告戦略など、〝育て方のプラン〟をつくる役割を担っている。この開発とマーケティング担当者は１チームとして緊密な関係を構築していて、それがアイデアから発売までのスピード感を生みだす。
１９４０年体制（増補版）,野口 悠紀雄,すなわち、事業経営を許可制とし、事業計画も許可制とする。これらを通じて、企業は政府の監督や統制を受け、また、設備の拡張、生産計画の変更などの命令も受けることになる。他方では、税制上の特典、助成金、資金調達上の優遇措置などの保護助成が与えられる。また、命令によって生じた損失に対しては、補償が与えられることとされた。
問い続ける力 (ちくま新書),石川善樹,たとえば、城があったら、とにかくそれを力攻めにするのが直接的アプローチです。一方、間接的アプローチは、この城を攻めても落ちないことがわかったとき、この城があることで相手はどういうメリットを得ているのかと考える。それで、城はふもとの街を守るために作られたんだということがわかれば、街を先に落としちゃえば、この城は存在意義がなくなっちゃうわけじゃないですか。だから、ふもとの街を落とすことで、間接的に城の存在価値を失わせて勝つのが間接的アプローチという方法です。
世界はなぜ地獄になるのか（小学館新書）,橘玲,あなたは社会になんらかの不満を抱き、その問題を解決するための正義を必要としているかもしれないが、それは別の誰かの正義とは異なるだけでなく、しばしば真っ向から衝突する。そしてリベラルな社会では、異なる正義に優劣をつけることは原理的にできない。
自由になるための技術　リベラルアーツ,山口周,今日の企業においては、基本的に業績が優れている人が出世しますね。でも、経済合理性から判断すると、業績を上げている人ほど上にいかずに現場にいたほうがじつは効率的なわけです。
三行で撃つ 〈善く、生きる〉ための文章塾,近藤 康太郎,　辞書を引くのは、言い換え語を探しているのではありません。わたしたちの、常套的でありきたりで平凡な発想、決まり文句のような視点を転換させるために、引くんです。 　 語彙を多彩で豊かにする。考え方の、〈ベクトル〉を変える。ものの見方を、〈変調〉させる。 辞書は、そのためにあります。 辞書は、言葉のエフェクター です。
モード後の世界 (扶桑社ＢＯＯＫＳ),栗野宏文,大きく分けて理由は二つ。第一の理由はラグジュアリーブランドの付加価値を支えるべき「あこがれ感」が以前のように「上から下」とならず、今や生活者に影響を与える発信者はユーチューバーやインスタグラマーへと移行したから。発信者と受信者の距離が近い、あるいは同等となりました。
運動しても痩せないのはなぜか：代謝の最新科学が示す「それでも運動すべき理由」,ハーマン・ポンツァー、小巻 靖子,─ヒトがなぜ脂肪を欲し、人体がなぜ手間を惜しまず脂肪を分解、貯蔵するのか、その理由──は、エネルギーを得るための燃焼である。すべての動物が脂肪という形でエネルギーを蓄えるよう進化したのは、わずか１オンス（約 30 グラム） の脂肪に２５５キロカロリーという、信じられないほどのエネルギーを詰め込むことができるからだ。
世界を変えた８つの企業,ウィリアム・マグヌソン、黒輪 篤嗣,3 社は約束を寸分違えることなく果たした。リウィウスの『ローマ建国史』には次のように書かれている。「物資の供給契約はきわめて寛大なものであるとともに、立派に実行に移された。兵士たちのもとに届けられた物資は、かつて国庫が潤沢だったときと比べてもまったく遜色がなかった」。物資の供給を受けられたおかげで、スキピオとその弟の軍隊は攻勢を維持でき、ハスドルバル（ハンニバルの弟）の軍との数度の会戦を制することができた。
宗教の起源,ロビン・ダンバー、小田哲,一五〇人規模の共同体は、社会性や認知能力の面でいえば霊長類の社会集団に相当する。つまり私たちの祖先はグルーミングというガラスの天井を破り、五〇人の上限を乗りこえて、私たちがいま暮らす一五〇人という大きな結束集団を発展させていったにちがいない。
マッキンゼー　ホッケースティック戦略―成長戦略の策定と実行,クリス・ブラッドリー、マーティン・ハート、スヴェン・シュミット、野崎 大輔、アンドレ・アンドニアン,独自の戦略決定に関する選択肢グリッドを構築するためには、選択の軸を――やり直しがきかない選択肢である必要があります――明らかにする必要があります。ある意味、ここでの選択は次世代の経営陣にとって所与のものになる内容、とも言えます。
国家はなぜ衰退するのか　権力・繁栄・貧困の起源（上）,ダロン・アセモグル、ジェイムズ・A・ロビンソン、鬼澤 忍,経済成長のプロセスとその土台となる包括的制度は、政治の舞台でも経済市場でも勝者とともに敗者を生み出す。創造的破壊への恐怖は往々にして、包括的な経済制度や政治制度への反発の原因となるのだ。
HIGH OUTPUT MANAGEMENT,アンドリュー・S・グローブ、小林　薫,今日のギャップを認識してそれを埋めるために、懸命に意思決定しようとしている人々があまりにも多い。しかし、今日のギャップは過去のいつかの時点で計画したときの失敗を表わしている。今日の問題を改めるのに必要な意思決定に集中することを強いられるのは、比喩的にいえば、車のガソリンが切れてしまって慌てておたおた走り回っているようなものだ。早目に満タンにしておくべきだったことは明らかである。このような運命に陥るのを避けるために、計画するときに解答しなければならない問いがあることを思い出そう。それは〝明日〟の問題を解決するために〝今日〟何をなすべきかについてである。
教養としてのアート 投資としてのアート,徳光健治,コンセプトが難解であることや、複雑なコンセプトを重ねることで意味を深めることだけが評価される時代はいずれ終焉を迎えることになるでしょ
ビジョナリー・カンパニーZERO ゼロから事業を生み出し、偉大で永続的な企業になる,ジム・コリンズ、ビル・ラジアー、土方 奈美,ひとつは、あなた自身をさらけ出すことだ。臆することなく自分の経験や観察したことを語ろう。自分自身について、あるいは自分の経験や世界に対する独特のモノの見方を語ると、たとえ個人的つながりのない相手であっても、聞き手とのあいだに親しみが生まれる。 もうひとつは率直に、自分らしく、気取らないかたちで伝えることだ。「一般的に」といった顔の見えない誰かではなく、「私たち」「あなた」「私」を主語に語ろう。「友達」や「仲間」といった温かみのある言葉を使い、目の前に相手がいるかのように語りかけよう。文章は短く、生き生きと。明確な表現、わかりやすい単語を選ぼう。 　「労使関係への対応に、何らかの不満があるのは明らかだ」ではなく、「みなさんがこれまでの扱いに怒っているのはよくわかる」 　「モルト飲料製品のバリューチェーンと品質を最大化するのが私たちの方針だ」ではなく、「われわれは最高のビールをつくる」 　「目の前の問題は、法務にまつわる経済的影響による財務リソースの減少だ」ではなく、「訴訟の費用負担が重い」
北条氏の時代 (文春新書),本郷 和人,この「已むに已まれぬ」は、義時のいつもの行動パターンだからです。畠山重忠の討伐にしても父時政の追放にしても承久の乱にしても、「不本意だが已むを得ない」という形を必ず取る。これは御家人の「世論」への配慮、建て前づくりのうまさと考えることもできるでしょう。
キーエンス解剖　最強企業のメカニズム,西岡 杏,キーエンスは、なぜ在庫を積むのか。それは「直近の利益よりも当日出荷が重要だという絶対的な優先順位があるからだ」とキーエンス社員は解説する。「キーエンスだったら、すぐに持ってきてくれる」という他社にない価値を守り続ければ、商品の売り値を維持でき、それが長期的な利益率向上につながるという発想だ。
世界の天才に「お金の増やし方」を聞いてきた,デイヴィッドＭ.ルーベンシュタイン,私は投資をギャンブルだとは考えていません。投資は、長期にわたり自分と家族の面倒を見ることだと考えています。つまり毎年同じだけの金額を長期にわたり投資しながら齢を重ね、そして豊かさを手にしているのです。
世界の天才に「お金の増やし方」を聞いてきた,デイヴィッドＭ.ルーベンシュタイン,　「単純化して説明できないものに、決して投資してはならない」。
世界秩序の変化に対処するための原則　なぜ国家は興亡するのか (日本経済新聞出版),レイ・ダリオ、斎藤聖美,● 将来を予測し、上手に対処する能力は、変化を招く因果関係を理解する能力と、その因果関係が過去にどう変化をもたらしたかを学習する能力とに依存するということだった。
国家はなぜ衰退するのか　権力・繁栄・貧困の起源（上）,ダロン・アセモグル、ジェイムズ・A・ロビンソン、鬼澤 忍,こんにち異なるパターンの制度が過去に深く根を下ろしているのは、いったん社会が特定の方法で組織されると、それが持続する傾向があるからだ。われわれは、この事実が政治的・経済的制度の相互作用の仕方に由来することを明らかにする。
自由になるための技術　リベラルアーツ,山口周,先生が以前からおっしゃっているように、一八世紀のドイツの哲学者、イマヌエル・カントの「理論理性」と「実践理性」の違いですね。カントの理論理性はウェーバーの「目的合理性」であり、これに従って行動するのは因果法則に従っているだけだというわけです。一方の実践理性は「価値合理性」であり、主観的な価値判断を行なう理性です。ここでリーダーに必要なのは実践理性のほうというわけですね。
爆速成長マネジメント,イラッド・ギル、浅枝 大志、大熊 希美,　そして事業のディフェンス面、参入障壁のつくり方の回答としては、プロダクト・イノベーションと流通網の組み合わせで築くべきと私は思います。
日本人のための第一次世界大戦史 (角川ソフィア文庫),板谷 敏彦,ビスマルクは、将来のドイツが東西両面での戦争を避けられるように、またフランスを孤立させるためにロシアとの間に安全保障条約を締結していました。
社会学の考え方〔第２版〕 (ちくま学芸文庫),ジグムント・バウマンティム・メイ、ティム・メイ、奥井智之,社会学は、人間の行為を、広範な 形成作用 figuration（５） の要素として考察することに特徴がある。すなわち、社会学は、ともに 相互依存（依存状態とは、特定の行為がなされる 蓋然性や、その行為がうまくいく可能性が、他の行為者が何者か、何をするか、あるいは何をなしうるかによって変化する状態にあることをいう） の 網の目 に組み込まれた行為者たちの選択的なnon-random集合の要素として、人間の行為を考察する。
国家はなぜ衰退するのか　権力・繁栄・貧困の起源（上）,ダロン・アセモグル、ジェイムズ・A・ロビンソン、鬼澤 忍,国家が衰退するのは、収奪的な政治制度に支えられた収奪的な経済制度を持つときだ。
自由になるための技術　リベラルアーツ,山口周,リベラルアーツというのは相対化の技術であり、相対化することによって初めて人は、誰もが常識だと思っている世界のありようについて、なぜそうなのか？　なぜ他のやり方ではないのか？　という問いを持てるのです。
テクノロジーの世界経済史　ビル・ゲイツのパラドックス,カール・B・フレイ、村井 章子、大野 一,エンゲルスの休止は、熟練職人を子供に置き換えるような技術の変化が起きている間ずっと続いた。イギリスの労働者がたびたび機械に対して暴動を起こしたのはこの時期である。だが産業革命に遅れてやってきた動力源である蒸気機関が登場すると、事態は変わる。蒸気を動力源にする機械は大型化、高度化、複雑化し、成人労働者のスキルが必要になったからだ。そうした機械が増えれば、設計し、据え付け、操作し、保守をする人間がその分だけ必要になる。
未来をつくる起業家　～日本発スタートアップの失敗と成功　20ストーリー～ (NextPublishing),ケイシー ウォール（Casey Wahl）,自分の中で、唯一リスクだと感じることは「時間」だけです。
確率思考の戦略論　どうすれば売上は増えるのか,森岡 毅、今西 聖貴,日本とスイスの腕時計戦争の事例は、プレファレンス（市場全体における購入回数の平均値）が低いとペネトレーション（浸透率）とフリークエンシー（購入頻度）は必ずセットで低くなるが、それでも特定の消費者層においてValue Per Purchase（購入単価）を顕著に高めて利益額で優位に立てることがあるという事例として理解すべきです。フリークエンシー（購入頻度）とValue Per Purchase（購入単価）を混同してはいけません。
Build: An Unorthodox Guide to Making Things Worth Making (English Edition),Tony Fadell,"Steve Jobs once said of management consulting, “You do get a broad cut at companies but it’s very thin. It’s like a picture of a banana: you might get a very accurate picture but it’s only two dimensions, and without the experience of actually doing it you never get three dimensional. So you might have a lot of pictures on your walls, you can show it off to your friends—I’ve worked in bananas, I’ve worked in peaches, I’ve worked in grapes—but you never really taste it.”"
脳の大統一理論　自由エネルギー原理とはなにか (岩波科学ライブラリー),乾 敏郎、阪口 豊,　つまり、私たちの脳は、「目の前にある物体の大きさは 10 センチメートルくらいである確率は 30 パーセント」「 50 センチメートルくらいである確率は 10 パーセント」といったように、確率を伴った形で推論結果を得ることができるのである。
問い続ける力 (ちくま新書),石川善樹,広すぎる問題を考えるときには、いったん、制約のあるところで考えてみて、そこで得られたものを拡大するのがいいと思います。
ヒットの設計図　ポケモンGOからトランプ現象まで (早川書房),デレク トンプソン、高橋 由紀子,オバマとファブローは、重要な演説を一緒に準備しながら「このスピーチの 背骨 は何だろう」という話をよくしたという。背骨とは、人を惹きつけるものであり、主題であり、話をまとめる「サビ」でもある。
日本人のための第一次世界大戦史 (角川ソフィア文庫),板谷 敏彦,「スペイン風邪」は、スペインがインフルエンザの発生地だから名付けられたわけではありません。第一次世界大戦の交戦国では、報道管制によって病気や死亡等の情報は制限されていましたが、その中で当時中立国だったスペインだけが病気に関する死亡者や患者数などの情報を公開していたのです。それが各国で新聞記事となって、世界各地で流行しているインフルエンザをスペイン発だと誤解したまま名前だけが残ったのです。
